[
  {
    "checkin_date": "2024-12-20",
    "checkout_date": "2024-12-25",
    "country": "Philippines",
    "email": "kritik@example.com",
    "guest_name": "Mik Kritiko Colegia",
    "guests": 23,
    "municipality": "Irosin",
    "payment_gateway": "GCash",
    "phone": "09806745631",
    "region": "Bicol Region",
    "resort_name": "Arcadia Beach Resort",
    "street_address": "A. Bonicaio Str.",
    "id": 2,
    "created_at": "2025-12-14T13:26:53.053400",
    "updated_at": "2025-12-14T13:26:53.053400"
  },
  {
    "checkin_date": "2025-12-16",
    "checkout_date": "2025-12-29",
    "country": "Philippines",
    "created_at": "2025-12-16T04:09:48.176286",
    "email": "kimenteria92@gmail.com",
    "guest_name": "Kim Ruzzel Enteria",
    "guests": 11,
    "id": 3,
    "municipality": "Sorsogon",
    "payment_gateway": "BANCO DE ORO",
    "phone": "09879605040",
    "region": "Bicol",
    "resort_name": "Kuya Boy Beach Resort",
    "street_address": "Zone-1",
    "updated_at": "2025-12-16T06:24:28.782063"
  },
  {
    "checkin_date": "2024-12-20",
    "checkout_date": "2024-12-25",
    "country": "Philippines",
    "email": "johndoe@example.com",
    "guest_name": "John Doe",
    "guests": 23,
    "municipality": "Irosin",
    "payment_gateway": "GCash",
    "phone": "09806745631",
    "region": "Bicol Region",
    "resort_name": "Kuya Boy Beach Resort",
    "street_address": "A. Bonicaio Str.",
    "id": 4,
    "created_at": "2025-12-16T04:14:31.182643",
    "updated_at": "2025-12-16T04:14:31.182643"
  },
  {
    "checkin_date": "2025-12-16",
    "checkout_date": "2025-12-29",
    "country": "Philippines",
    "email": "jacky@gmail.com",
    "guest_name": "Smith Jane",
    "guests": 21,
    "municipality": "Davao City",
    "payment_gateway": "BANCO DE ORO",
    "phone": "09876543202",
    "region": "Davao",
    "resort_name": "Arcadia Beach Resort",
    "street_address": "Zone-1",
    "updated_at": "2025-12-16T06:02:45.622560",
    "id": 6,
    "created_at": "2025-12-16T06:02:45.622560"
  },
  {
    "guest_name": "Smith Jane",
    "email": "janesmith@gmail.com",
    "phone": "09876543212",
    "street_address": "Zone-1",
    "municipality": "Davao City",
    "region": "Davao",
    "country": "Philippines",
    "resort_name": "Arcadia Beach Resort",
    "checkin_date": "2025-12-16",
    "checkout_date": "2025-12-29",
    "guests": 21,
    "payment_gateway": "GCash",
    "id": 7,
    "created_at": "2025-12-16T06:07:09.498724",
    "updated_at": "2025-12-16T06:07:09.498724"
  },
  {
    "guest_name": "Jane Smith",
    "email": "janesmith@gmail.com",
    "phone": "09876543212",
    "street_address": "Zone-1",
    "municipality": "Davao City",
    "region": "Davao",
    "country": "Philippines",
    "resort_name": "Arcadia Beach Resort",
    "checkin_date": "2025-12-16",
    "checkout_date": "2025-12-29",
    "guests": 21,
    "payment_gateway": "GCash",
    "id": 8,
    "created_at": "2025-12-16T06:10:19.033294",
    "updated_at": "2025-12-16T06:10:19.033294"
  },
  {
    "checkin_date": "2024-12-20",
    "checkout_date": "2024-12-25",
    "country": "Philippines",
    "email": "johndoe@example.com",
    "guest_name": "John Doe",
    "guests": 23,
    "municipality": "Irosin",
    "payment_gateway": "GCash",
    "phone": "09806745631",
    "region": "Bicol Region",
    "resort_name": "Kuya Boy Beach Resort",
    "street_address": "A. Bonicaio Str.",
    "id": 9,
    "created_at": "2025-12-16T06:10:47.826774",
    "updated_at": "2025-12-16T06:10:47.826774"
  },
  {
    "checkin_date": "2024-12-20",
    "checkout_date": "2024-12-25",
    "country": "Philippines",
    "email": "johndoe@example.com",
    "guest_name": "John Doe",
    "guests": 23,
    "municipality": "Irosin",
    "payment_gateway": "GCash",
    "phone": "09806745631",
    "region": "Bicol Region",
    "resort_name": "Kuya Boy Beach Resort",
    "street_address": "A. Bonicaio Str.",
    "id": 10,
    "created_at": "2025-12-16T06:21:37.770078",
    "updated_at": "2025-12-16T06:21:37.770078"
  },
  {
    "guest_name": "Jane Smith",
    "email": "janesmith@gmail.com",
    "phone": "09876543212",
    "street_address": "Zone-1",
    "municipality": "Davao City",
    "region": "Davao",
    "country": "Philippines",
    "resort_name": "Arcadia Beach Resort",
    "checkin_date": "2025-12-16",
    "checkout_date": "2025-12-29",
    "guests": 21,
    "payment_gateway": "GCash",
    "id": 11,
    "created_at": "2025-12-16T06:21:50.705928",
    "updated_at": "2025-12-16T06:21:50.705928"
  },
  {
    "checkin_date": "2025-12-16",
    "checkout_date": "2025-12-29",
    "country": "Philippines",
    "email": "jacky@gmail.com",
    "guest_name": "Smith Jane",
    "guests": 21,
    "municipality": "Davao City",
    "payment_gateway": "GCash",
    "phone": "09876543202",
    "region": "Davao",
    "resort_name": "Arcadia Beach Resort",
    "street_address": "Zone-1",
    "updated_at": "2025-12-16T06:23:49.617403",
    "id": 12,
    "created_at": "2025-12-16T06:23:49.617403"
  },
  {
    "guest_name": "Smith Jane",
    "email": "janesmith@gmail.com",
    "phone": "09876543212",
    "street_address": "Zone-1",
    "municipality": "Davao City",
    "region": "Davao",
    "country": "Philippines",
    "resort_name": "Arcadia Beach Resort",
    "checkin_date": "2025-12-16",
    "checkout_date": "2025-12-29",
    "guests": 21,
    "payment_gateway": "GCash",
    "created_at": "2025-12-16T06:24:14.473392",
    "updated_at": "2025-12-16T06:24:14.473392",
    "id": 13
  }
]